,Claimant(s)/Nationality(ies): i,Date Registered:,Economic Sector:,Instrument(s) Invoked: i,Latest Development:,Outcome of Proceeding:,Respondent(s):,Status of Proceeding:,Subject of Dispute:291,"Tenaris S.A. (Luxembourg), Talta - Trading e Marketing Sociedade Unipessoal Lda. (Portuguese)",21-Aug-12,Other Industry,"BIT Venezuela, Republica Bolivariana de - Belgium-Luxembourg 1998, BIT Venezuela, Republica Bolivariana de - Portugal 1994","May 29, 2018 - Tenaris SA and Talta - Trading E Marketing Sociedade Unipessoal Lda  file a rejoinder on annulment.","December 12, 2016 - The Tribunal renders its award.",Bolivarian Republic of Venezuela (Venezuelan),Concluded,Production of hot briquetted iron and steel products292,Venoklim Holding B.V. (Dutch),15-Aug-12,Other Industry,Investment Law - Venezuela (1999),,"April 3, 2015 - The Tribunal declares the proceeding closed in accordance with ICSID Arbitration Rule 38(1).",Bolivarian Republic of Venezuela (Venezuelan),Concluded,Lubricant production facilities293,"F√°brica de Vidrios Los Andes, C.A. (Venezuelan), Owens-Illinois de Venezuela, C.A. (Venezuelan)",10-Aug-12,Other Industry,"BIT Netherlands - Venezuela, Republica Bolivariana de 1991","June 12, 2018 - The ad hoc Committee holds a first session by telephone conference.","November 13, 2017 - The Tribunal renders its award.",Bolivarian Republic of Venezuela (Venezuelan),Concluded,Glass production enterprise294,Blue Bank International & Trust (Barbados) Ltd. (Barbadian),07-Aug-12,Tourism,"BIT Venezuela, Republica Bolivariana de - Barbados 1994","May 21, 2018 - The Bolivarian Republic of Venezuela files further observations on Blue Bank International &Trust (Barbados) Ltd.‚Äôs further response of May 16, 2018.","April 26, 2017 - The Tribunal renders its award; attached to the award is a separate opinion by presiding arbitrator Christer S√∂derlund.",Bolivarian Republic of Venezuela (Venezuelan),Concluded,Tourism and hospitality facilities295,"Consorcio Siderurgia Amazonia S.L. (Spanish), Ternium S.A. (Luxembourg)",01-Aug-12,Other Industry,"BIT Spain - Venezuela, Republica Bolivariana de 1995, BIT Venezuela, Republica Bolivariana de - Belgium-Luxembourg 1998",,"November 29, 2012 - The Secretary-General issues a procedural order taking note of the discontinuance of the proceeding pursuant to ICSID Arbitration Rule 44.",Bolivarian Republic of Venezuela (Venezuelan),Concluded,Steel production facilities296,Rusoro Mining Ltd. (Canadian),01-Aug-12,"Oil, Gas & Mining","BIT Canada - Venezuela, Republica Bolivariana de 1996",,"August 22, 2016 - The Tribunal renders its award.",Bolivarian Republic of Venezuela (Venezuelan),Concluded,Gold exploration and exploitation operations297,Valle Verde Sociedad Financiera S.L. (Spanish),25-Jul-12,Finance,"BIT Spain - Venezuela, Republica Bolivariana de 1995",,"April 27, 2018 - The Tribunal issues a procedural order for the discontinuance of the proceeding for lack of payment of the required advances, pursuant to ICSID Administrative and Financial Regulation 14(3)(d).",Bolivarian Republic of Venezuela (Venezuelan),Concluded,Banking enterprise298,"IGB18 Las Rozas, S.L. (Spanish), Inversi√≥n y Gesti√≥n de Bienes, IGB, S.L. (Spanish)",09-Jul-12,Construction,"BIT Spain - Venezuela, Republica Bolivariana de 1995",,"August 14, 2015 - The Sole Arbitrator renders the award.",Kingdom of Spain (Spanish),Concluded,Construction project299,"Novera AD (Bulgarian), Novera Properties B.V. (Dutch), Novera Properties N.V. (Dutch)",03-Jul-12,"Water, Sanitation & Flood Protection",BIT Netherlands - Bulgaria 1999,,"August 27, 2015 - The Tribunal renders its award.",Republic of Bulgaria (Bulgarian),Concluded,Waste management services300,Republic of Equatorial Guinea (Equatorial Guinean),29-Jun-12,"Oil, Gas & Mining",Contract,,"May 12, 2015 - The Sole Conciliator renders its Report.",CMS Energy Corporation and others (U.S.),Concluded,Oil and gas enterprise301,Veolia Propret√© (French),25-Jun-12,"Water, Sanitation & Flood Protection","BIT France - Egypt, Arab Republic of 1974",,"May 25, 2018 - The Tribunal renders its award.",Arab Republic of Egypt (Egyptian),Concluded,Waste management services302,"Churchill Mining Plc (British), Planet Mining Pty Ltd (Australian)",22-Jun-12,"Oil, Gas & Mining","BIT Australia - Indonesia 1992, BIT Indonesia - United Kingdom of Great Britain and Northern Ireland 1976","June 19, 2018 - The ad hoc Committee issues Procedural Order No. 2 concerning procedural matters.","December 6, 2016 - The Tribunal renders its award.",Republic of Indonesia (Indonesian),Concluded,Coal mining project303,Telef√≥nica S.A. (Spanish),21-Jun-12,Information & Communication,BIT Spain - Mexico 2006,,"February 20, 2018 - The Tribunal issues an order taking note of the discontinuance of the proceeding pursuant to Article 49(1) of the Arbitration (Additional Facility) Rules.",United Mexican States (Mexican),Concluded,Telecommunications services304,Saint-Gobain Performance Plastics Europe (French),15-Jun-12,Other Industry,"BIT Venezuela, Republica Bolivariana de - France 2001","June 7, 2018 - The ad hoc Committee is constituted in accordance with Article 52(3) of the ICSID Convention.  Its members are: Ricardo Ram√≠rez Hern√°ndez (Mexican), President; Lawrence Boo (Singaporean); and Olufunke Adekoya (British/ Nigerian); all members appointed by the Chairman of the Administrative Council.","November 3, 2017 - The Tribunal renders its award.",Bolivarian Republic of Venezuela (Venezuelan),Concluded,Proppant production305,"Kernkraftwerk Brunsb√ºttel GmbH & Co. oHG (German), Kernkraftwerk Kr√ºmmel GmbH (German), Vattenfall AB (Swedish), Vattenfall Europe Nuclear Energy GmbH (German), Vattenfall GMBH (German)",31-May-12,Electric Power & Other Energy,ECT (Energy Charter Treaty),"May 30, 2018 - Each party files observations on the non-disputing party‚Äôs update to its written submission of September 30, 2015.",,Federal Republic of Germany (German),Pending,Nuclear power plant306,"Ampal-American Israel Corporation (U.S.), BSS-EMG Investors LLC (U.S.), EGI Series Investors LLP (U.S.), EGI-Fund (08-10) Investors (U.S.)",23-May-12,"Oil, Gas & Mining","BIT Egypt, Arab Republic of - United States of America 1986, BIT Egypt, Arab Republic of - Germany 2005","February 23, 2017 - The Tribunal issues a Procedural Order No. 9 concerning quantum experts.",,Arab Republic of Egypt (Egyptian),Pending,Natural gas export307,"Mercer International, Inc. (U.S.)",16-May-12,Other Industry,NAFTA (North American Free Trade Agreement),"April 20, 2018 - The Claimant files a request for a supplementary decision.","March 6, 2018 - The Tribunal renders its award.",Canada (Canadian),Concluded,Pulp mill and electric power generation plant308,"Hess Equatorial Guinea, Inc. and Tullow Equatorial Guinea Limited (nationality not available)",15-May-12,"Oil, Gas & Mining",Contract,"October 5, 2017 - The suspension of the constitution of commission is further extended until January 31, 2018, pursuant to the parties‚Ä_agreement.",,Republic of Equatorial Guinea (Equatorial Guinean),Pending,Hydrocarbon concession309,RSM Production Corporation (U.S.),23-Apr-12,"Oil, Gas & Mining",Contract,"April 16, 2018 - RSM Production Corporation files a reply on annulment.","July 15, 2016 - The Tribunal renders its award; attached to the award is an assenting opinion by arbitrator Gavan Griffith.",Saint Lucia (St. Lucian),Concluded,Hydrocarbons exploration agreement310,Dan Cake (Portugal) S.A. (Portuguese),19-Apr-12,Other Industry,BIT Hungary - Portugal 1992,"June 4, 2018 - The ad hoc Committee is constituted in accordance with Article 52(3) of the ICSID Convention.  Its members are: Cavinder Bull (Singaporean), President; Antonio Crivellaro (Italian); and M√≥nica Pinto (Argentine); all members appointed by the Chairman of the Administrative Council.","November 21, 2017 - The Tribunal renders its award.","Republic of Uzbekistan (Uzbek), Hungary (Hungarian)",Concluded,Food products enterprise311,Soci√©t√© Industrielle des Boissons de Guin√©e (Guinean),05-Apr-12,Other Industry,"Investment Law - Guinea (1987), Contract",,"May 21, 2014 - The Tribunal declares the proceeding closed in accordance with ICSID Arbitration Rule 38(1).",Republic of Guinea (Guinean),Concluded,Beverage production enterprise312,"E.ON Ruhrgas International GmbH (German), GDF International SAS (French), Slovak Gas Holding BV (Dutch)",05-Apr-12,"Oil, Gas & Mining",ECT (Energy Charter Treaty),,"March 19, 2013 - The Tribunal renders its award embodying the parties‚Ä_settlement agreement, pursuant to ICSID Arbitration Rule 43(2).",Slovak Republic (Slovak),Concluded,Natural gas services313,"Bankrupt Sehil In≈üaat Endustri ve Ticaret Ltd. Sti. (Turkish), Muhammet √_p (Turkish)",26-Mar-12,Construction,BIT Turkmenistan - Turkey 1992,"March 16, 2018 - The proposal for disqualification of Tribunal member Bernard Hanotiau is declined by the other two members of the Tribunal.  The proceeding is resumed pursuant to ICSID Arbitration Rules 53 and 9(6).",,Turkmenistan (Turkmen),Pending,Construction projects314,Grupo Francisco Hernando Contreras (Spanish),23-Mar-12,Construction,BIT Equatorial Guinea - Spain 2003,,"December 4, 2015 - The Tribunal renders its award.",Republic of Equatorial Guinea (Equatorial Guinean),Concluded,Construction of housing and sports facilities315,"Apotex Holdings Inc. (Canadian), Apotex Inc. (Canadian)",16-Mar-12,Other Industry,NAFTA (North American Free Trade Agreement),,"August 25, 2014 - The Tribunal renders its award.",United States of America (U.S.),Concluded,Pharmaceutical enterprise316,"Elecnor S.A. (Spanish), Isolux Cors√°n Concesiones S.A. (Spanish)",15-Feb-12,Electric Power & Other Energy,BIT Spain - Peru 1994,,"March 25, 2014 - The Tribunal renders its award embodying the parties' settlement agreement, pursuant to ICSID Arbitration Rule 43(2).",Republic of Peru (Peruvian),Concluded,Electricity transmission concession317,Supervision y Control S.A. (Spanish),09-Feb-12,Transportation,BIT Costa Rica - Spain 1997,,"January 18, 2017 - The Tribunal renders its award; arbitrator Joseph P. Klock Jr. dissents.",Republic of Costa Rica (Costa Rican),Concluded,Concession agreement to build and operate motor vehicle inspection facilities318,"Accession Mezzanine Capital L.P. (British), Danubius Keresked√∂h√°z Vagyonkezel√∂ Zrt. (Hungarian)",18-Jan-12,Information & Communication,BIT United Kingdom of Great Britain and Northern Ireland - Hungary 1987,,"April 17, 2015 - The Tribunal declares the proceeding closed in accordance with ICSID Arbitration Rule 38(1).",Hungary (Hungarian),Concluded,Radio broadcasting enterprises319,"Emmis International Holding, B.V. (Dutch), Emmis Radio Operating, B.V. (Dutch), MEM Magyar Electronic Media Kereskedelmi √©s Szolg√°ltat√≥ Kft. (Hungarian)",18-Jan-12,Information & Communication,"BIT Hungary - Switzerland 1988, BIT Netherlands - Hungary 1987",,"April 16, 2014 - The Tribunal declares the proceeding closed in accordance with ICSID Arbitration Rule 38(1).",Hungary (Hungarian),Concluded,Radio broadcasting enterprises320,Adel A Hamadi Al Tamimi (U.S.),23-Dec-11,"Oil, Gas & Mining",FTA Oman ‚Ä_United States of America 2006,,"November 3, 2015 - The Tribunal renders its award.",Sultanate of Oman (Omani),Concluded,Limestone quarry321,Indorama International Finance Limited (British),02-Dec-11,Other Industry,"BIT Egypt, Arab Republic of - United Kingdom of Great Britain and Northern Ireland 1975",,"July 2, 2015 - The Tribunal issues a procedural order taking note of the discontinuance of the proceeding pursuant to ICSID Arbitration Rule 43(1).",Arab Republic of Egypt (Egyptian),Concluded,Textile enterprise322,"Gambrinus, Corp. (Barbadian)",02-Dec-11,Other Industry,"BIT Venezuela, Republica Bolivariana de - Barbados 1994",,"June 15, 2015 - The Tribunal renders its award.",Bolivarian Republic of Venezuela (Venezuelan),Concluded,Fertilizer enterprise323,Hortensia Margarita Shortt (British),21-Nov-11,Transportation,"BIT Venezuela, Republica Bolivariana de - United Kingdom of Great Britain and Northern Ireland 1995",,"May 11, 2015 - The Secretary-General issues an order taking note of the discontinuance of the proceeding pursuant to ICSID Arbitration Rule 45.",Bolivarian Republic of Venezuela (Venezuelan),Concluded,Maritime transport services324,"Getma International (French), Getma International Investissements (French), NCT Infrastructure & Logistique (French), NCT Necotrans (French)",03-Nov-11,Transportation,Investment Law - Guinea (1987),,"August 16, 2016 - The Tribunal renders its award; attached to the award is a dissenting opinion by arbitrator Bernardo M. Cremades.",Republic of Guinea (Guinean),Concluded,Port development project325,Tulip Real Estate and Development Netherlands B.V. (Dutch),28-Oct-11,Construction,BIT Netherlands - Turkey 1986,,"March 10, 2014 - The Tribunal renders its award; attached to the award is a separate opinion by arbitrator Michael Evan Jaffe.",Republic of Turkey (Turkish),Concluded,Residential and commercial construction project326,Baggerwerken Decloedt En Zoon NV (Belgian),11-Oct-11,Transportation,BIT Philippines - Belgium-Luxembourg 1998,,"January 23, 2017 - The Tribunal renders its award; attached to the award is a concurring opinion by Pierre Tercier and a separate opinion by Stanimir A. Alexandrov.",Republic of the Philippines (Philippine),Concluded,Dredging operations327,Mobile TeleSystems OJSC (Russian),05-Oct-11,Information & Communication,BIT Russian Federation - Turkmenistan 2009,,"September 21, 2012 - The Tribunal issues a procedural order taking note of the discontinuance of the proceeding pursuant to ICSID Arbitration (Additional Facility) Rule 49(1).",Turkmenistan (Turkmen),Concluded,Telecommunications enterprise328,"Talta - Trading e Marketing Sociedade Unipessoal Lda. (Portuguese), Tenaris S.A. (Luxembourg)",30-Sep-11,Other Industry,"BIT Venezuela, Republica Bolivariana de - Belgium-Luxembourg 1998, BIT Venezuela, Republica Bolivariana de - Portugal 1994","June 4, 2018 - The ad hoc Committee declares the proceeding closed in accordance with ICSID Arbitration Rules 53 and 38(1).","January 29, 2016 - The Tribunal renders its award.",Bolivarian Republic of Venezuela (Venezuelan),Concluded,Hot briquetted iron production plant329,OI European Group B.V. (Dutch),26-Sep-11,Other Industry,"BIT Netherlands - Venezuela, Republica Bolivariana de 1991","March 9, 2018 - The proposal for disqualification of ad hoc Committee member √Ålvaro Castellanos Howell is declined by the other two members of the ad hoc Committee.  The proceeding is resumed pursuant to ICSID Arbitration Rules 53 and 9(6).","March 10, 2015 - The Tribunal renders its award.",Bolivarian Republic of Venezuela (Venezuelan),Concluded,Glass production enterprise330,RSM Production Corporation (nationality not available),19-Sep-11,"Oil, Gas & Mining",Contract,,"June 11, 2013 - The Commission renders its Report.",Republic of Cameroon (Cameroonian),Concluded,Hydrocarbons exploration and exploitation concession agreement331,Mamidoil Jetoil Greek Petroleum Products Societe Anonyme S.A. (Greek),12-Sep-11,"Oil, Gas & Mining",BIT Greece - Albania 1991,,"March 30, 2015 - The Tribunal renders its award; attached to the award is a dissenting opinion by arbitrator Steven A. Hammond.",Republic of Albania (Albanian),Concluded,Oil storage and distribution project332,Franck Charles Arif (French),23-Aug-11,Services & Trade,BIT France - Moldova 1997,,"April 8, 2013 - The Tribunal renders its award.",Republic of Moldova (Moldovan),Concluded,Duty free concessions333,Vigotop Limited (Cypriot),04-Aug-11,Tourism,BIT Cyprus - Hungary 1989,,"October 1, 2014 - The Tribunal renders its award.",Hungary (Hungarian),Concluded,Resort development334,"DP World Callao S.R.L. (Peruvian), P&O Dover (Holding) Limited (British), The Peninsular and Oriental Steam Navigation Company (British)",22-Jul-11,Transportation,BIT Peru - United Kingdom of Great Britain and Northern Ireland 1993 - Contract,"October 5, 2016 - The Tribunal issues Procedural Order No. 8 concerning procedural matters.",,Republic of Peru (Peruvian),Pending,Pier concession agreement335,Garanti Koza LLP (British),20-Jul-11,Transportation,"BIT Turkmenistan - Turkey 1992, BIT United Kingdom of Great Britain and Northern Ireland - Turkmenistan 1995",,"December 19, 2016 - The Tribunal renders its award.",Turkmenistan (Turkmen),Concluded,Construction project336,"Koch Minerals S√†rl (Swiss), Koch Nitrogen International S√†rl (Swiss)",19-Jul-11,Other Industry,"BIT Venezuela, Republica Bolivariana de - Switzerland 1993",,"October 30, 2017 - The Tribunal renders its award; attached to the award is a partial dissenting opinion by arbitrator Zachary Douglas.",Bolivarian Republic of Venezuela (Venezuelan),Concluded,Construction and operation of fertilizer plant337,"Burimi S.R.L. (Italian), Eagle Games SH.A (Albanian)",12-Jul-11,Other Industry,BIT Albania - Italy 1991 - Investment Law - Albania (1993),,"May 29, 2013 - The Tribunal renders its award.",Republic of Albania (Albanian),Concluded,Gaming industry338,"Gremcitel S.A. (Peruvian), Ren√©e Rose Levy (French)",24-Jun-11,Construction,BIT France - Peru 1993,,"January 9, 2015 - The Tribunal renders its award.",Republic of Peru (Peruvian),Concluded,Property development project339,"Damac Gamsha Bay for Development S.A.E. (Egyptian), Damac Park Avenue for Real Estate Development S.A.E. (Egyptian), Hussain Sajwani (United Arab Emirates)",20-Jun-11,Tourism,"BIT Egypt, Arab Republic of - United Arab Emirates 1997",,"September 10, 2014 - The Tribunal issues a procedural order taking note of the discontinuance of the proceeding pursuant to ICSID Arbitration Rule 44.",Arab Republic of Egypt (Egyptian),Concluded,Property development projects340,Ekran Berhad (Malaysian),24-May-11,Services & Trade,"BIT China - Israel 1995, BIT Malaysia - China 1988",,"May 16, 2013 - The parties file a request for the discontinuance of the proceeding pursuant to ICSID Arbitration Rule 43(1).",People's Republic of China (Chinese),Concluded,Arts and culture facilities341,"Diamond Fields Liberia, Inc. (British)",20-May-11,"Oil, Gas & Mining",Contract,,"March 11, 2016 - The Secretary-General issues a procedural order taking note of the discontinuance of the proceeding pursuant to ICSID Arbitration Rule 43(1).",Republic of Liberia (Liberian),Concluded,Mineral exploration operations342,Rafat Ali Rizvi (British),19-May-11,Finance,BIT Indonesia - United Kingdom of Great Britain and Northern Ireland 1976,,"July 16, 2013 - The Tribunal renders its award; attached to the award is a separate opinion by arbitrator Muthucumaraswamy Sornarajah.",Republic of Indonesia (Indonesian),Concluded,Banking enterprise343,Fraport AG Frankfurt Airport Services Worldwide (German),27-Apr-11,Transportation,BIT Germany - Philippines 1997,,"September 16, 2014 - The Tribunal decides on the admissibility of new evidence.",Republic of the Philippines (Philippine),Concluded,Construction of an airport terminal344,"Atlantic Investment Partners LLC (U.S.), Schooner Capital LLC (U.S.), Vincent J. Ryan (U.S.)",26-Apr-11,"Agriculture, Fishing & Forestry",BIT United States of America - Poland 1990,,"November 24, 2015 - The Tribunal renders its award; attached to the award is a partial dissenting opinion by arbitrator Francisco Orrego Vicu√±a.",Republic of Poland (Polish),Concluded,Vegetable oil production and processing enterprise345,"AHS Niger (Nigerien), Menzies Middle East and Africa S.A. (Luxembourg)",26-Apr-11,Services & Trade,"Contract, Investment Law - Niger (1989)",,"July 15, 2013 - The Tribunal renders its award.",Republic of Niger (Nigerien),Concluded,Ground handling services346,"The Williams Companies, International Holdings B.V. (Dutch), WilPro Energy Services (El Furrial) Limited (British), WilPro Energy Services (Pigap II) Limited (British)",20-Apr-11,"Oil, Gas & Mining","BIT Netherlands - Venezuela, Republica Bolivariana de 1991",,"February 8, 2017 - The Secretary-General issues a procedural order taking note of the discontinuance of the proceeding pursuant to ICSID Arbitration Rule 45.",Bolivarian Republic of Venezuela (Venezuelan),Concluded,Gas compression and injection enterprises347,Caravel√≠ Cotaruse Transmisora de Energ√≠a S.A.C. (Peruvian),15-Apr-11,Electric Power & Other Energy,Contract,,"April 15, 2013 - The Tribunal renders its award.",Republic of Peru (Peruvian),Concluded,Electricity transmission agreements348,Agility for Public Warehousing Company K.S.C. (Kuwaiti),28-Mar-11,Services & Trade,BIT Kuwait - Pakistan 1983,,"August 1, 2016 - The Tribunal renders its award.",Islamic Republic of Pakistan (Pakistani),Concluded,Customs clearance services349,National Gas S.A.E. (Egyptian),22-Mar-11,"Oil, Gas & Mining","BIT Egypt, Arab Republic of - United Arab Emirates 1997",,"April 3, 2014 - The Tribunal declares the proceeding closed in accordance with ICSID Arbitration Rule 38(1).",Arab Republic of Egypt (Egyptian),Concluded,Gas pipelines construction and operation agreement350,Bawabet Al Kuwait Holding Company (Kuwaiti),18-Mar-11,Other Industry,"BIT Egypt, Arab Republic of - Kuwait 2001",,"November 11, 2016 - The Tribunal issues a procedural order taking note of the discontinuance of the proceeding pursuant to ICSID Arbitration Rule 43(1).",Arab Republic of Egypt (Egyptian),Concluded,Chemical products enterprise351,Crystallex International Corporation (Canadian),09-Mar-11,"Oil, Gas & Mining","BIT Canada - Venezuela, Republica Bolivariana de 1996",,"April 4, 2016 - The Tribunal renders its award.",Bolivarian Republic of Venezuela (Venezuelan),Concluded,Mining company352,Longreef Investments A.V.V. (Dutch),23-Feb-11,"Agriculture, Fishing & Forestry","BIT Netherlands - Venezuela, Republica Bolivariana de 1991","May 24, 2018 - The ad hoc Committee is constituted in accordance with Article 52(3) of the ICSID Convention. Its members are: David Pawlak (Irish/American), President; Milton Argueta (Guatemalan); and Felipe Bulnes (Chilean); all members appointed by the Chairman of the Administrative Council.","November 6, 2017 - The Tribunal renders its award.",Bolivarian Republic of Venezuela (Venezuelan),Concluded,Coffee production facilities353,Nova Scotia Power Incorporated (Canadian),26-Jan-11,"Oil, Gas & Mining","BIT Canada - Venezuela, Republica Bolivariana de 1996",,"April 30, 2014 - The Tribunal renders its award.",Bolivarian Republic of Venezuela (Venezuelan),Concluded,Coal supply agreement354,"Casinos Austria International Holding GmbH (Austrian), Club Hotel Loutraki S.A. (Greek)",21-Jan-11,Other Industry,"BIT Greece - Serbia 1997, BIT Serbia - Austria 2001",,"January 18, 2012 - The Tribunal issues a procedural order taking note of the discontinuance of the proceeding pursuant to ICSID Arbitration Rule 44.",Republic of Serbia (Serbian),Concluded,Operation of gaming and entertainment facilities355,"Accession Eastern Europe Capital AB (Swedish), Mezzanine Management Sweden AB (Swedish)",20-Jan-11,"Water, Sanitation & Flood Protection",BIT Sweden - Bulgaria 1994,,"July 23, 2012 - The Secretary-General issues a procedural order taking note of the discontinuance of the proceeding pursuant to ICSID Arbitration Rule 45.",Republic of Bulgaria (Bulgarian),Concluded,Waste management services356,T√ºrkiye Petrolleri Anonim Ortaklƒ±ƒüƒ± (Turkish),14-Jan-11,"Oil, Gas & Mining",BIT Turkey - Kazakhstan 1992 - ECT (Energy Charter Treaty),,"August 18, 2014 - The Tribunal renders its award embodying the parties‚Ä_settlement agreement, pursuant to ICSID Arbitration Rule 43(2).",Republic of Kazakhstan (Kazakhstani),Concluded,Oil exploration and production joint venture357,"Highbury International AVV (Dutch), Ramstein Trading Inc. (Panamanian)",05-Jan-11,"Oil, Gas & Mining","BIT Netherlands - Venezuela, Republica Bolivariana de 1991 - Investment Law - Venezuela (1999)","February 22, 2018 - The ad hoc Committee holds a hearing on annulment in Washington, D.C.","September 26, 2013 - The Tribunal renders its award.",Bolivarian Republic of Venezuela (Venezuelan),Concluded,Mining concession358,"Border Timbers International (Private) Limited (Zimbabwean), Border Timbers Limited (Zimbabwean), Hangani Development Co. (Private) Limited (Zimbabwean)",20-Dec-10,"Agriculture, Fishing & Forestry",BIT Zimbabwe - Switzerland 1996,"April 3, 2018 - April 5, 2018 - The ad hoc Committee holds a hearing on annulment in Paris.","July 28, 2015 - The Tribunal renders its award.",Republic of Zimbabwe (Zimbabwean),Concluded,Forestry and timber processing enterprises359,ƒ∞√ßkale ƒ∞n≈üaat Limited ≈ûirketi (Turkish),20-Dec-10,Construction,BIT Turkmenistan - Turkey 1992,,"March 8, 2016 - The Tribunal renders its award; attached to the award are two partially dissenting opinions by arbitrator Carolyn B. Lamm and Philippe Sands.",Turkmenistan (Turkmen),Concluded,Design and construction contracts360,"TECO Guatemala Holdings, LLC (U.S.)",23-Nov-10,Electric Power & Other Energy,CAFTA-DR (Dominican Republic-Central America Free Trade Agreement),"May 30, 2018 - The Claimant files a reply on the merits.","December 19, 2013 - The Tribunal renders its award.",Republic of Guatemala (Guatemalan),Concluded,Electricity distribution concession361,"Serdar Elh√ºseyni (Turkish), √ñmer Dede (Turkish)",19-Nov-10,Other Industry,BIT Turkey - Romania 1991,,"September 5, 2013 - The Tribunal declares the proceeding closed in accordance with ICSID Arbitration Rule 38(1).",Romania (Romanian),Concluded,Agricultural machinery and equipment enterprise