,Claimant(s)/Nationality(ies): i,Date Registered:,Economic Sector:,Instrument(s) Invoked: i,Latest Development:,Outcome of Proceeding:,Respondent(s):,Status of Proceeding:,Subject of Dispute:0,"Bay View Group LLC (U.S.), The Spalena Company LLC (U.S.)",22-Jun-18,"Oil, Gas & Mining",BIT Rwanda - United States of America 2008,"June 22, 2018 - The Acting Secretary-General registers a request for the institution of arbitration proceedings. ",,Republic of Rwanda (Rwandese),Pending,Mining concessions1,Veolia Propret√© SAS (French),20-Jun-18,Electric Power & Other Energy,ECT (Energy Charter Treaty),"June 20, 2018 - The Secretary-General registers a request for the institution of arbitration proceedings.",,Italian Republic (Italian),Pending,Renewable energy generation enterprise2,"LSG Building Solutions GmbH (Austrian), Pressburg UK GmbH (German), Green Source Consulting GmbH (Austrian), Solluce Romania 1 B.V. (Dutch), Risen Energy Solar Project GmbH (German), Core Value Investments GmbH & Co KG Gamma (German), Core Value Capital GmbH (Austrian), SC LJG Green Source Energy Beta SRL (Romanian), Anina Pro Invest Ltd (Cypriot), Giust Ltd (Cypriot)",12-Jun-18,Electric Power & Other Energy,ECT (Energy Charter Treaty),"June 12, 2018 - The Secretary-General registers a request for the institution of arbitration proceedings. ",,Romania (Romanian),Pending,Renewable energy generation enterprise3,Ipek Investment Limited (British),29-May-18,"Oil, Gas & Mining",BIT Turkey - United Kingdom of Great Britain and Northern Ireland 1991,"May 29, 2018 - The Secretary-General registers a request for the institution of arbitration proceedings.",,Republic of Turkey (Turkish),Pending,"Mining enterprise, Telecommunications enterprise"4,Autopista del Norte S.A.C. (Peruvian),18-May-18,Transportation,Contract,"June 8, 2018 - Following appointment by the Claimant, Antonio Crivellaro (Italian) accepts his appointment as arbitrator.",,Republic of Peru (Peruvian),Pending,Contract for the construction of a highway system5,Togo Terminal (Togolese),14-May-18,Construction,Contract,"May 14, 2018 - The Secretary-General registers a request for the institution of arbitration proceedings.",,Republic of Togo (Togolese),Pending,Container handling operations6,NEPC Consortium Power Limited (Bangladeshi),14-May-18,Electric Power & Other Energy,Contract,"May 14, 2018 - The Secretary-General registers a request for the institution of arbitration proceedings. ",,Bangladesh Power Development Board (Bangladeshi),Pending,Electric power generation project7,HOCHTIEF Infrastructure GmbH (German),03-May-18,Construction,BIT Saudi Arabia - Germany 1996,"May 3, 2018 - The Secretary-General registers a request for the institution of arbitration proceedings.",,Kingdom of Saudi Arabia (Saudi Arabian),Pending,"Construction, development and expansion of airport terminal"8,Galway Gold Inc. (Canadian),18-Apr-18,"Oil, Gas & Mining",FTA Canada - Colombia,"May 8, 2018 - Following appointment by the Claimant, Alfredo Bullard (Peruvian) accepts his appoint as arbitrator.",,Republic of Colombia (Colombian),Pending,Mining concession9,Red Eagle Exploration Limited (Canadian),18-Apr-18,"Oil, Gas & Mining",FTA Canada - Colombia,"May 4, 2018 - Following appointment by the Claimants, Jos√© Mart√≠nez de Hoz (Argentine) accepts his appointment as arbitrator.",,Republic of Colombia (Colombian),Pending,Mining concession10,"Kimberly-Clark Dutch Holdings, B.V. (Dutch), Kimberly-Clark S.L.U. (Spanish), Kimberly-Clark BVBA (Belgian)",17-Apr-18,Services & Trade,"BIT Spain - Venezuela, Republica Bolivariana de 1995, BIT Netherlands - Venezuela, Republica Bolivariana de 1991, BIT Venezuela, Republica Bolivariana de - Belgium-Luxembourg 1998","April 17, 2018 - The Acting Secretary-General registers a request for the institution of arbitration proceedings.",,Bolivarian Republic of Venezuela (Venezuelan),Pending,Retail11,"Soci√©t√© des Parcs d‚ÄôAlger (Algerian), Emirates International Investment Company LLC (United Arab Emirates)",05-Apr-18,Construction,Contract,"April 5, 2018 - The Acting Secretary-General registers a request for the institution of arbitration proceedings. ",,People‚Äôs Democratic Republic of Algeria (Algerian),Pending,Real Estate Project12,Soci_t_ dÅfEnergie et dÅfEau du Gabon (Gabonese),30-Mar-18,Electric Power & Other Energy,Contract,"June 20, 2018 - The Commission holds a first session in Paris.",,Gabonese Republic (Gabonese),Pending,Water services and electric power concession13,"Western African Aquaculture Ltd (Gambian), Kurt Lennart Hansson (Swedish), Martje Bolt Hansson (Australian)",28-Mar-18,"Agriculture, Fishing & Forestry",,"March 28, 2018 - The Secretary-General registers a request for the institution of arbitration proceedings. ",,Republic of The Gambia (Gambian),Pending,Farming enterprise14,Delta Belarus Holding BV (Dutch),22-Mar-18,Finance,BIT Belarus - Netherlands 1995,"March 22, 2018 - The Secretary-General registers a request for the institution of arbitration proceedings. ",,Republic of Belarus (Belarussian),Pending,Banking enterprise15,"Rand Investments Ltd. (Canadian), Sembi Investment Limited (Cypriot), William Archibald Rand (Canadian), Kathleen Elizabeth Rand (Canadian), Allison Ruth Rand (Canadian), Robert Harry Leander Rand (Canadian)",22-Mar-18,"Agriculture, Fishing & Forestry","BIT Canada - Serbia 2014, BIT Serbia - Cyprus 2005","May 17, 2018 - Following appointment by the Respondent, Marcelo Kohen (Argentine) accepts his appointment as arbitrator.",,Republic of Serbia (Serbian),Pending,Agricultural enterprise16,Mr. Shin Dong Baig (Korean),19-Mar-18,Other Industry,"BIT Korea, Republic of - Vietnam 1993","June 11, 2018 - Following appointment by the Respondent, Albert Jan van den Berg (Dutch) accepts his appointment as arbitrator.",,Socialist Republic of Vietnam (Vietnamese),Pending,Real estate project17,Corral Morocco Holdings AB (Swedish),14-Mar-18,"Oil, Gas & Mining",BIT Morocco - Sweden 1990,"March 14, 2018 - The Acting Secretary-General registers a request for the institution of arbitration proceedings.",,Kingdom of Morocco (Moroccan),Pending,Operation and development of an oil refinery18,Mr. Cem Sel√ßuk Ersoy (Turkish),14-Mar-18,Construction,BIT Turkey - Azerbaijan 1994,"June 21, 2018 - Following appointment by the Respondent, Jean Engelmayer Kalicki (U.S.) accepts her appointment as arbitrator.",,Republic of Azerbaijan (Azerbaijani),Pending,Tunnel construction project19,Astrida Benita Carrizosa (U.S.),09-Mar-18,Finance,"BIT Colombia - India 2009, BIT Colombia - Switzerland 2006 - TPA United States ‚Ä_Colombia 2006","March 9, 2018 - The Secretary-General registers a request for the institution of arbitration proceedings.",,Republic of Colombia (Colombian),Pending,Bank20,Cascade Investments NV (Belgian),28-Feb-18,Services & Trade,BIT Belgium-Luxembourg - Turkey 1986,"June 4, 2018 - Following appointment by the Respondent, Jan Paulsson (French/Swedish) accepts his appointment as arbitrator.",,Republic of Turkey (Turkish),Pending,Media services21,"Telef√≥nica, S.A. (Spanish)",20-Feb-18,Information & Communication,BIT Colombia - Spain 2005,"April 26, 2018 - Following appointment by the Respondent, Yves Derains (French) accepts his appointment as arbitrator.",,Republic of Colombia (Colombian),Pending,Telecommunications services22,Almasryia for Operating & Maintaining Touristic Construction Co. L.L.C. (Egyptian),14-Feb-18,Tourism,"BIT Egypt, Arab Republic of - Kuwait 2001","May 28, 2018 - Following appointment by the Respondent, Rolf Knieper (German) accepts his appointment as arbitrator.",,State of Kuwait (Kuwaiti),Pending,Real estate project23,ACF Renewable Energy Limited (Maltese),14-Feb-18,Electric Power & Other Energy,ECT (Energy Charter Treaty),"June 1, 2018 - The Tribunal is constituted in accordance with Article 37(2)(b) of the ICSID Convention. Its members are: Bruno Simma (Austrian/German), President, appointed by the agreement of the parties; Oscar Garibaldi (Argentine/U.S.), appointed by the Claimant; and Pierre Mayer (French), appointed by the Respondent.",,Republic of Bulgaria (Bulgarian),Pending,Renewable energy generation enterprise24,GRAND EXPRESS Non-Public Joint Stock Company (Russian),31-Jan-18,Other Industry,"Agreement for Encouragement and Mutual Protection of Investments in the Member States of the Eurasian Economic Community (2008) , Treaty on the Eurasian Economic Union (2014)","May 4, 2018 - Following appointment by the Respondent, J. Christopher Thomas (Canadian) accepts his appointment as arbitrator.",,Republic of Belarus (Belarussian),Pending,Railcar manufacturing plant25,"Erste Group Bank AG (Austrian), Steierm√§rkische Bank und Sparkassen AG (Austrian), Erste & Steierm√§rkische Bank d.d. (Croatian)",29-Dec-17,Finance,BIT Croatia - Austria 1997,"June 22, 2018 - The Tribunal is constituted in accordance with Article 37(2)(a) of the ICSID Convention. Its members are: Andr√©s Rigo Sureda (Spanish), President, appointed by the Chairman of the Administrative Council in accordance with Article 38 of the ICSID Convention; Andreas Bucher (Swiss), appointed by the Claimants; and Lazar Tomov (Bulgarian), appointed by the Respondent.",,Republic of Croatia (Croatian),Pending,Banking services and debt instruments26,"Wise Solutions CDI, SA (Ivorian)",29-Dec-17,"Water, Sanitation & Flood Protection",Contract,"June 6, 2018 - The Tribunal is constituted in accordance with Article 37(2)(b) of the ICSID Convention. Its members are: Ra√´d Fathallah (Canadian/Lebanese), President, appointed by the agreement of the parties; Bernard Hanotiau (Belgian), appointed by the Claimant; and Brigitte Stern (French), appointed by the Respondent.",,Republic of C√¥te d'Ivoire (Ivorian),Pending,Waste management project27,"AS Norvik Banka (Latvian), Grigory Guselnikov (British), Yulia Guselnikova (British), Alexander Guselnikov (British), Aglaya Guselnikova (British), Pyotr Guselnikov (British)",28-Dec-17,Finance,BIT Latvia - United Kingdom of Great Britain and Northern Ireland 1994,"April 3, 2018 - Following appointment by the Respondent, Peter Tomka (Slovak) accepts his appointment as arbitrator.",,Republic of Latvia (Latvian),Pending,Banking enterprise28,Cunico Resources N.V. (Dutch),21-Dec-17,Other Industry,"BIT Netherlands - Macedonia, Former Yugoslav Republic of 1998","June 4, 2018 - The Tribunal issues Procedural Order No. 1 concerning procedural matters.",,"Macedonia, former Yugoslav Republic of (Macedonian)",Pending,Metal industry plant29,Mazen Al Ramahi (Jordanian),21-Dec-17,Tourism,BIT Jordan - Hungary 2007,"June 6, 2018 - The Tribunal is constituted in accordance with Article 37(2)(a) of the ICSID Convention. Its members are: Ian Binnie (Canadian), President, appointed by the agreement of the parties; Hamid Gharavi (French/Iranian), appointed by the Claimant; and Brigitte Stern (French), appointed by the Respondent.",,Hungary (Hungarian),Pending,Hotel operation project30,"The Lopez-Goyne Family Trust (U.S.), David Michael Goyne (U.S.), Esther Valentina Goyne (U.S.), Janet A. Bochnowski (U.S.), David A. Barish (U.S.), Gale Ruth Feuer Barnish (U.S.), James Douglas Goyne (U.S.), Raymond Gerald (U.S.), Bailey (U.S.), Anita Mejarito-Guzman Ross (U.S.), Elsbeth Irene Foster (U.S.), The Goyne Family Trust (U.S.), Scott Stuart Shogreen (U.S.), Eloisa Lopez Schogreen (U.S.), Harold Orris Shattuck (U.S.), Diane Elizabeth Radu (U.S.), Walter John Bilger (U.S.), The Bochnowski Family Trust (U.S.), The Barnish Family Trust of 2008 (U.S.), Hill Exploration Corporation (U.S.), LG Hawaii Oil & Gas, Inc. (U.S.), LG Hawaii Development Corporation (U.S.), Michael David Goyne (U.S.), Emily Lopez Goyne (U.S.)",19-Dec-17,"Oil, Gas & Mining",CAFTA-DR (Dominican Republic-Central America Free Trade Agreement),"January 10, 2018 - Following appointment by the Respondent, Brigitte Stern (French) accepts her appointment as arbitrator.",,"Ministerio de Fomento, Industria y Comercio, Managua, Nicaragua",Pending,Hydrocarbons concession31,"Samsung Engineering Co., Ltd. (Korean)",10-Nov-17,Electric Power & Other Energy,"BIT Saudi Arabia - Korea, Republic of 2002","June 21, 2018 - The Tribunal issues Procedural Order No. 1 concerning procedural matters.",,Kingdom of Saudi Arabia (Saudi Arabian),Pending,Electric power generation project32,MAKAE Europe SARL (French),08-Nov-17,Other Industry,BIT France - Saudi Arabia 2002,"June 25, 2018 - The Tribunal holds a first session by telephone conference.",,Kingdom of Saudi Arabia (Saudi Arabian),Pending,Retail enterprise33,"DCM Energy GmbH & Co. Solar 1 KG (German), DCM Energy GmbH & Co. Solar 2 KG (German), Edisun Power Europe A.G. (Swiss), Hannover Leasing Sun Invest 2 Spanien Beteiligungs GmbH (German), Hannover Leasing Sun Invest 2 Spanien GmbH & Co. KG (German)",31-Oct-17,Electric Power & Other Energy,ECT (Energy Charter Treaty),"June 14, 2018 - The Tribunal is constituted in accordance with Article 37(2)(a) of the ICSID Convention.  Its members are: Carole Malinvaud (French), President, appointed by the Secretary-General pursuant to the parties‚Ä_agreement; Oscar M. Garibaldi (Argentine/U.S.), appointed by the the Claimants; and Pierre-Marie Dupuy (French), appointed by the Respondent.",,Kingdom of Spain (Spanish),Pending,Renewable energy generation enterprise34,APCL Gambia B.V. (Dutch),17-Oct-17,"Oil, Gas & Mining","BIT Gambia, The - Netherlands 2002",,"June 7, 2018 - The Secretary-General issues a procedural order taking note of the discontinuance of the proceeding pursuant to ICSID Arbitration Rule 43(1).",Republic of The Gambia (Gambian),Concluded,Hydrocarbon concession35,"APCL Gambia B.V. (Dutch), African Petroleum Gambia Limited (British)",17-Oct-17,"Oil, Gas & Mining",Contract,,"June 7, 2018 - The Tribunal issues a procedural order taking note of the discontinuance of the proceeding pursuant to ICSID Arbitration Rule 43(1).",Republic of The Gambia (Gambian),Concluded,Hydrocarbon concession36,"APCL Gambia B.V. (Dutch), African Petroleum Gambia Limited (British)",17-Oct-17,"Oil, Gas & Mining",Contract,"June 7, 2018 - The Tribunal issues Procedural Order No. 1 consolidating ICSID Cases African Petroleum Gambia Limited and APCL Gambia B.V. v. Republic of The Gambia (ICSID Cases No. ARB/17/38), African Petroleum Gambia Limited and APCL Gambia B.V. v. Republic of The Gambia (ICSID Cases No. ARB/17/39), and APCL Gambia B.V. v. Republic of The Gambia (ICSID Cases No. ARB/17/40).",,Republic of The Gambia (Gambian),Pending,Hydrocarbon concession37,"Addiko Bank d.d. (Croatian), Addiko Bank AG (Austrian)",27-Sep-17,Finance,BIT Croatia - Austria 1997,"May 18, 2018 - The Tribunal issues Procedural Order No. 1 concerning procedural matters.",,Republic of Croatia (Croatian),Pending,Banking services and debt instruments38,"Arin Capital & Investment Corp. (U.S.), Edmond Khudyan (U.S.)",27-Sep-17,Construction,BIT United States of America - Armenia 1992,"June 7, 2018 - The Tribunal issues Procedural Order No. 1 concerning procedural matters.",,Republic of Armenia (Armenian),Pending,Real estate and land development39,Venoklim Holding B.V. (Dutch),25-Sep-17,Other Industry,"BIT Netherlands - Venezuela, Republica Bolivariana de 1991","March 19, 2018 - The Tribunal is constituted in accordance with Article 9 of the Arbitration (Additional Facility) Rules.  Its members are: Eduardo Dami√£o Gon√ßalves (Brazilian), President, appointed by the Chairman of the Administrative Council in accordance with Article 10 of the Arbitration (Additional Facility) Rules; Juan Pablo C√°rdenas Mej√≠a (Colombian), appointed by the Claimant; and Gabriel Bottini (Argentine), appointed by the Respondent.",,Bolivarian Republic of Venezuela (Venezuelan),Pending,Lubricant production facilities40,Addiko Bank AG (Austrian),19-Sep-17,Finance,"BIT Yugoslavia, Federal Republic of - Austria 2001","May 7, 2018 - Following appointment by the co-arbitrators, Bernard Hanotiau (Belgian) accepts his appointment as presiding arbitrator.",,Montenegro (Montenegrin),Pending,Banking services and debt instruments41,"Vento Motorcycles, Inc. (U.S.)",15-Sep-17,Services & Trade,NAFTA (North American Free Trade Agreement),"June 15, 2018 - The Tribunal issues Procedural Order No. 2 concerning production of documents.",,United Mexican States (Mexican),Pending,Transportation industry42,"Raiffeisen Bank International AG (Austrian), Raiffeisenbank Austria d.d. (Croatian)",15-Sep-17,Finance,BIT Croatia - Austria 1997,"June 25, 2018 - The Tribunal holds a first session by telephone conference.",,Republic of Croatia (Croatian),Pending,Banking services and debt instruments43,"EcoDevelopment in Europe AB (Swedish), Bagamoyo EcoEnergy Limited (Tanzanian), Agro EcoEnergy Tanzania Limited (Tanzanian), EcoEnergy Africa AB (Swedish)",11-Sep-17,"Agriculture, Fishing & Forestry",BIT Sweden - Tanzania 1999,"April 24, 2018 - The Tribunal issues Procedural Order No. 1.",,United Republic of Tanzania (Tanzanian),Pending,Agribusiness project44,"Elitech B.V. (Dutch), Razvoj Golf D.O.O. (Croatian)",06-Sep-17,Tourism,BIT Croatia - Netherlands 1998,"June 6, 2018 - The Tribunal issues Procedural Order No. 1 concerning procedural matters.",,Republic of Croatia (Croatian),Pending,Real estate projects45,Future Pipe International B.V. (Dutch),24-Aug-17,"Water, Sanitation & Flood Protection","BIT Netherlands - Egypt, Arab Republic of 1996","May 4, 2018 - The Claimant files a memorial on the merits.",,Arab Republic of Egypt (Egyptian),Pending,Pipe manufacturing enterprise46,Lotus Holding Anonim ≈ûirketi (Turkish),22-Aug-17,Electric Power & Other Energy,BIT Turkmenistan - Turkey 1992 - ECT (Energy Charter Treaty),"June 17, 2018 - The Claimant files a rejoinder on preliminary objections pursuant to ICSID Arbitration Rule 41(5).",,Turkmenistan (Turkmen),Pending,Energy47,"Silk Road Holdings B.V. (Dutch), Gardabani Holdings B.V. (Dutch)",18-Aug-17,Electric Power & Other Energy,BIT Georgia - Netherlands 1998,"June 13, 2018 - The Tribunal holds a first session by telephone conference.",,Georgia (Georgian),Pending,Electric power generation and distribution48,Eutelsat S.A. (French),16-Aug-17,Information & Communication,BIT Mexico - France 1998,"June 8, 2018 - The Tribunal is constituted in accordance with Article 6(3) of the Additional Facility Rules. Its members are: Alfredo Bullard (Peruvian), President, appointed by agreement of the Parties; Francisco Orrego Vicu√±a (Chilean), appointed by the Claimant; and Marcelo Kohen (Argentine), appointed by the Respondent.",,United Mexican States (Mexican),Pending,Telecommunications concession49,"LTME Mauritius Limited (Mauritian), Madamobil Holdings Mauritius Limited (Mauritian)",09-Aug-17,Information & Communication,BIT Madagascar - Mauritius 2004 - Investment Law - Madagascar (2008),"June 22, 2018 - The Tribunal is constituted in accordance with Article 37(2)(a) of the ICSID Convention. Its members are: David A.O. Edward (British), President, appointed by the Chairman of the Administrative Council in accordance with Article 38 of the ICSID Convention; Fernando Mantilla-Serrano (Colombian), appointed by the Claimants; and Brigitte Stern (French), appointed by the Respondent.",,Republic of Madagascar (Malagasy),Pending,Telecommunications enterprise50,"Kintyre Kft (Hungarian), Inicia Zrt (Hungarian), Magyar Farming Company Ltd (British)",01-Aug-17,"Agriculture, Fishing & Forestry",BIT United Kingdom of Great Britain and Northern Ireland - Hungary 1987,"April 27, 2018 - The Claimants file a memorial on the merits.",,Hungary (Hungarian),Pending,Farming Enterprise51,"Puma Energy PNG Refining Limited (Papua New Guinea), Puma Energy PNG Supply Ltd (British)",31-Jul-17,"Oil, Gas & Mining",Contract,,"May 2, 2018 - The Tribunal issues a procedural order taking note of the discontinuance of the proceeding pursuant to ICSID Arbitration Rule 43(1).",Independent State of Papua New Guinea (Papua New Guinea),Concluded,Oil refinery52,Mabco Constructions SA (Swiss),21-Jul-17,Tourism,"BIT Kosovo, Republic of - Switzerland 2011 - Investment Law - KOSOVO (2014)","March 12, 2018 - The proceeding is stayed for non-payment of the required advances pursuant to ICSID Administrative and Financial Regulation 14(3)(d).",,Republic of Kosovo (Kosovar),Pending,Acquisition of shares53,"Burhan Enu≈ütekin (Turkish), Bursel Tekstil Sanayi Ve Di≈_Ticaret A.≈_ (Turkish), Selim Kaptanoƒülu (Turkish)",19-Jul-17,Other Industry,BIT Turkey - Uzbekistan 1992 - Investment Law - Uzbekistan (1998),"May 11, 2018 - The Tribunal issues Procedural Order No. 1 on procedural matters.",,Republic of Uzbekistan (Uzbek),Pending,Textile Enterprise54,"CMC Muratori Cementisti CMC Di Ravenna SOC. Coop. (Italian,Mozambican), CMC Africa Austral, LDA (Italian,Mozambican), CMC MuratoriCementisti CMC Di Ravenna SOC. Coop. A.R.L. Maputo Branch and CMC Africa (Italian,Mozambican)",14-Jul-17,Construction,BIT Italy - Mozambique 1998,"May 22, 2018 - The Tribunal issues Procedural Order No. 2 concerning production of documents.",,Republic of Mozambique (Mozambican),Pending,Highway construction project55,Big Sky Energy Corporation (U.S.),07-Jul-17,"Oil, Gas & Mining",BIT United States of America - Kazakhstan 1992,"June 18, 2018 - The Tribunal is reconstituted. Its members are Bernardo M. Cremades (Spanish), President; Stanimir Alexandrov (Bulgarian), appointed by the Claimant; and Peter Tomka (Slovak) appointed by the Respondent in accordance with ICSID Arbitration Rule 11(1). The proceeding is resumed pursuant to ICSID Arbitration Rule 12.",,Republic of Kazakhstan (Kazakhstani),Pending,Oil and gas exploration and production56,DP World Limited (United Arab Emirates),29-Jun-17,Transportation,BIT United Arab Emirates - Belgium-Luxembourg 2004,"April 20, 2018 - The Tribunal issues Procedural Order No. 2 concerning the Respondent‚Äôs request to address the objections to jurisdiction as a preliminary question.",,Kingdom of Belgium (Belgian),Pending,Port concession agreement57,BM M√ºhendislik ve ƒ∞n≈üaat A.≈_ (Turkish),28-Jun-17,Construction,,"February 14, 2018 - The Tribunal issues Procedural Order No. 1 concerning procedural matters.",,United Arab Emirates (United Arab Emirates),Pending,Construction58,"Mr. Jorge Blanco (U.S.), Mr. Joshua Dean Nelson (U.S.)",26-Sep-16,Information & Communication,NAFTA (North American Free Trade Agreement),"June 8, 2018 - The Tribunal issues Procedural Order No. 7 concerning procedural matters.",,United Mexican States (Mexican),Pending,Telecommunications enterprise59,Hela Schwarz GmbH (German),21-Jun-17,Other Industry,BIT China - Germany 2003,"April 10, 2018 - The Tribunal decides on provisional measures and the Claimant‚Äôs request to amend the request for arbitration.",,People‚Äôs Republic of China (Chinese),Pending,Spice products company60,"Peter de Sutter (Belgian), Kristof De Sutter (Belgian), (DS)2, S.A. (Luxembourg)",14-Jun-17,Other Industry,BIT Belgium-Luxembourg - Madagascar 2005,"May 17, 2018 - The Tribunal decides on the Respondent‚Äôs request of April 30, 2018.",,Republic of Madagascar (Malagasy),Pending,Textile enterprise61,"MetLife Seguros de Retiro S.A. (Argentine), MetLife Servicios S.A. (Argentine), MetLife, Inc. (U.S.)",14-Jun-17,Other Industry,BIT United States of America - Argentina 1991,"April 6, 2018 - The Tribunal holds a first session by telephone conference.",,Argentine Republic (Argentine),Pending,Pension system62,"Carlos Rios (Colombian), Francisco Javier Rios (Colombian)",13-Jun-17,Transportation,FTA Colombia - Chile,"June 13, 2018 - The Respondent files a counter-memorial on the merits and a memorial on jurisdiction.",,Republic of Chile (Chilean),Pending,Transportation concession63,Portigon AG (German),22-May-17,Electric Power & Other Energy,ECT (Energy Charter Treaty),"May 31, 2018 - The Tribunal issues Procedural Order No. 2 concerning procedural matters.",,Kingdom of Spain (Spanish),Pending,Renewable energy generation enterprise64,"Rockhopper Exploration Plc (British), Rockhopper Italia S.p.A. (Italian), Rockhopper Mediterranean Ltd (British)",19-May-17,"Oil, Gas & Mining",,"June 1, 2018 - The Claimants file a rejoinder on preliminary objections pursuant to ICSID Arbitration Rule 41(5).",,Italian Republic (Italian),Pending,Oil and gas exploration and production65,"WRB Enterprises, Inc. (U.S.), Grenada Private Power Limited (Grenadian)",15-May-17,Electric Power & Other Energy,Contract,"June 22, 2018 - The Respondent files observations on the Claimants‚Ä_request for provisional measures.",,Grenada (Grenadian),Pending,Electricity enterprise66,Jochem Bernard Buse (Dutch),11-May-17,Finance,BIT Netherlands - Panama 2000,"April 19, 2018 - The Tribunal issues Procedural Order No. 3 concerning production of documents.",,Republic of Panama (Panamanian),Pending,Financial services67,"Pawlowski AG (Swiss), Project Sever s.r.o. (Czech)",03-May-17,Construction,BIT Switzerland - Czech Republic 1990,"February 13, 2018 - The Tribunal issues Procedural Order No. 1 concerning procedural matters.",,Czech Republic (Czech),Pending,Real estate development68,,,Other Industry,BIT Lao People's Democratic Republic - China 1993,"June 25, 2018 - The Claimants file a renewed request for the Tribunal to decide on production of documents.",,Lao People‚Äôs Democratic Republic (Lao),Pending,Gaming Industry